{
  "id": "example-plugin",
  "name": "Example Plugin",
  "version": "1.0.0",
  "description": "An example plugin demonstrating the plugin structure",
  "author": "Ascend Digital",
  "category": "utilities",
  "tags": ["example", "template"],
  "main": "index.js",
  "repository": {
    "type": "git",
    "url": "https://github.com/Ascend-Digital/claude-plugins"
  },
  "engines": {
    "claude": ">=1.0.0"
  },
  "permissions": [],
  "config": {}
}
